{
 "subject": "dance",
 "board": "AQA",
 "topic": "dance-terminology",
 "topicName": "Dance Terminology & Action Words",
 "version": 1,
 "questions": [
  {
   "id": "dance-terminology-q1",
   "type": "short-answer",
   "question": "Q: Name the six types of action content.",
   "marks": 1,
   "commandWord": "state",
   "ao": "AO1",
   "difficulty": 2,
   "markScheme": {
    "points": [
     {
      "text": "Travel, turn, jump, gesture, stillness and transfer of weight.",
      "marks": 1
     }
    ]
   }
  },
  {
   "id": "dance-terminology-q2",
   "type": "short-answer",
   "question": "Q: How does dynamic content differ from action content?",
   "marks": 1,
   "commandWord": "describe",
   "ao": "AO1",
   "difficulty": 2,
   "markScheme": {
    "points": [
     {
      "text": "Action content describes what the body does (e.g. jump); dynamic content describes how it is performed (e.g. sudden, strong jump versus sustained, light rise).",
      "marks": 1
     }
    ]
   }
  },
  {
   "id": "dance-terminology-q3",
   "type": "short-answer",
   "question": "Q: Give an example of spatial content in a dance.",
   "marks": 1,
   "commandWord": "state",
   "ao": "AO1",
   "difficulty": 2,
   "markScheme": {
    "points": [
     {
      "text": "A dancer moving in a circular pathway at a high level across the general space, using diagonal direction towards downstage left.",
      "marks": 1
     }
    ]
   }
  },
  {
   "id": "dance-terminology-q4",
   "type": "short-answer",
   "question": "Q: Name three types of relationship content.",
   "marks": 1,
   "commandWord": "state",
   "ao": "AO1",
   "difficulty": 2,
   "markScheme": {
    "points": [
     {
      "text": "Unison, canon and contact — though contrast, complement and leader-follower are also valid.",
      "marks": 1
     }
    ]
   }
  },
  {
   "id": "dance-terminology-q5",
   "type": "short-answer",
   "question": "Q: Why is it important to use all four content categories when analysing a dance?",
   "marks": 1,
   "commandWord": "describe",
   "ao": "AO1",
   "difficulty": 2,
   "markScheme": {
    "points": [
     {
      "text": "Using all four categories ensures you cover every aspect of the movement — action, dynamics, space and relationships — giving a thorough and complete analysis.",
      "marks": 1
     }
    ]
   }
  }
 ]
}