{
 "subject": "drama",
 "board": "AQA",
 "topic": "DR11-devising-process-and-stimulus",
 "topicName": "Devising Process and Stimulus",
 "version": 1,
 "questions": [
  {
   "id": "dr11-devising-process-and-stimulus-q1",
   "type": "short-answer",
   "question": "Describe the process you would use to develop a piece of drama from a stimulus. Use a specific example.",
   "marks": 1,
   "commandWord": "describe",
   "ao": "AO1",
   "difficulty": 2,
   "markScheme": {
    "points": [
     {
      "text": "Full process: receive stimulus → initial reactions → research → brainstorm → improvise → select strongest ideas → structure → rehearse → refine. Give a specific stimulus example showing each stage.",
      "marks": 1
     }
    ]
   }
  },
  {
   "id": "dr11-devising-process-and-stimulus-q2",
   "type": "short-answer",
   "question": "How can research enhance a devised piece? What types of research might you do?",
   "marks": 1,
   "commandWord": "state",
   "ao": "AO1",
   "difficulty": 2,
   "markScheme": {
    "points": [
     {
      "text": "Research adds depth and authenticity: factual research (statistics, history), personal research (interviews, experiences), artistic research (other plays, art works). It prevents cliches and enriches content.",
      "marks": 1
     }
    ]
   }
  },
  {
   "id": "dr11-devising-process-and-stimulus-q3",
   "type": "short-answer",
   "question": "Explain how collaborative devising is different from working with a script. What are the challenges and benefits?",
   "marks": 1,
   "commandWord": "explain",
   "ao": "AO1",
   "difficulty": 2,
   "markScheme": {
    "points": [
     {
      "text": "Collaborative: everyone contributes ideas, ownership is shared, multiple perspectives enrich the work. Challenges: compromise, conflicting visions, unequal contribution. Benefits: creativity, investment, diverse ideas.",
      "marks": 1
     }
    ]
   }
  },
  {
   "id": "dr11-devising-process-and-stimulus-ext",
   "type": "extended",
   "question": "Full-Mark Response You are given the stimulus of a photograph showing a divided community. Describe how you would use this stimulus to devise a piece of drama, explaining your process from initial response to final performance. <div class=\"",
   "marks": 4,
   "commandWord": "describe",
   "ao": "AO2",
   "difficulty": 4,
   "markScheme": {
    "points": [
     {
      "text": "A grade 9 response will: describe the initial response to the stimulus; show detailed research plans; explain how exploration techniques (improvisation, hot-seating) develop ideas; describe the selection process; show how the piece is structured; justify each creative decision with reference to intended effect on the audience. Mark scheme: Devising is Component 2 (30% NEA). You must submit a devised performance and a portfolio. The portfolio must document yo...",
      "marks": 4
     }
    ],
    "exemplarAnswer": "A grade 9 response will: describe the initial response to the stimulus; show detailed research plans; explain how exploration techniques (improvisation, hot-seating) develop ideas; describe the selection process; show how the piece is structured; justify each creative decision with reference to intended effect on the audience. Mark scheme: Devising is Component 2 (30% NEA). You must submit a devised performance and a portfolio. The portfolio must document yo..."
   }
  }
 ]
}