{
 "subject": "economics",
 "board": "AQA",
 "topic": "EC16-interest-rates-and-saving",
 "topicName": "Interest Rates, Saving and Borrowing",
 "version": 1,
 "questions": [
  {
   "id": "ec16-interest-rates-and-saving-q1",
   "type": "short-answer",
   "question": "Explain how a rise in interest rates affects consumers' decisions to save, borrow, and spend.",
   "marks": 1,
   "commandWord": "explain",
   "ao": "AO1",
   "difficulty": 2,
   "markScheme": {
    "points": [
     {
      "text": "Saving: more attractive (higher returns on savings accounts). Borrowing: more expensive (higher loan and mortgage repayments, reducing disposable income). Spending: falls (higher mortgage payments leave less for discretionary spending; saving becomes relatively more attractive than spending). Overall: higher rates reduce economic activity.",
      "marks": 1
     }
    ]
   }
  },
  {
   "id": "ec16-interest-rates-and-saving-q2",
   "type": "short-answer",
   "question": "Explain how a fall in interest rates might affect a firm's decision to invest in new equipment.",
   "marks": 1,
   "commandWord": "explain",
   "ao": "AO1",
   "difficulty": 2,
   "markScheme": {
    "points": [
     {
      "text": "Lower interest rates make borrowing cheaper, so a firm is more likely to take out a loan for new equipment because: loan repayments are lower, the return on investment is more likely to exceed borrowing costs, and the opportunity cost of investing (forgone interest on savings) is lower. This stimulates investment and future productive capacity.",
      "marks": 1
     }
    ]
   }
  },
  {
   "id": "ec16-interest-rates-and-saving-q3",
   "type": "short-answer",
   "question": "Evaluate whether the Bank of England should raise interest rates when inflation is rising.",
   "marks": 1,
   "commandWord": "evaluate",
   "ao": "AO1",
   "difficulty": 2,
   "markScheme": {
    "points": [
     {
      "text": "Arguments for raising rates: reduces spending and borrowing, cooling demand-pull inflation; makes saving attractive, reducing money supply growth; signals the Bank is serious about controlling inflation. Arguments against: higher mortgage costs hurt households; business investment falls, reducing future growth; could trigger recession if rates rise too fast. Conclusion: the Bank should raise rates",
      "marks": 1
     }
    ]
   }
  },
  {
   "id": "ec16-interest-rates-and-saving-ext",
   "type": "extended",
   "question": "Full-Mark Response Evaluate the impact of a significant rise in interest rates on first-time homebuyers and on pensioners with savings. <div class=\"",
   "marks": 4,
   "commandWord": "evaluate",
   "ao": "AO2",
   "difficulty": 4,
   "markScheme": {
    "points": [
     {
      "text": "A grade 9 response will: analyse homebuyers (higher mortgage payments, reduced affordability, may be unable to buy, house prices may fall reducing wealth); analyse pensioners (savings earn more interest, fixed-income investments become more valuable, but if they have mortgages they also suffer); conclude: the impact is highly unequal — asset-rich pensioners benefit while indebted young people suffer, widening intergenerational inequality. Policy should consider distributional effects alongside macroeconomic goals.",
      "marks": 4
     }
    ],
    "exemplarAnswer": "A grade 9 response will: analyse homebuyers (higher mortgage payments, reduced affordability, may be unable to buy, house prices may fall reducing wealth); analyse pensioners (savings earn more interest, fixed-income investments become more valuable, but if they have mortgages they also suffer); conclude: the impact is highly unequal — asset-rich pensioners benefit while indebted young people suffer, widening intergenerational inequality. Policy should consider distributional effects alongside macroeconomic goals."
   }
  }
 ]
}