{
 "subject": "dance",
 "board": "AQA",
 "topic": "technical-skills-dance",
 "topicName": "Technical Dance Skills",
 "version": 1,
 "questions": [
  {
   "id": "technical-skills-dance-q1",
   "type": "short-answer",
   "question": "Q: What is the difference between posture and alignment?",
   "marks": 1,
   "commandWord": "state",
   "ao": "AO1",
   "difficulty": 2,
   "markScheme": {
    "points": [
     {
      "text": "Posture is the overall way the body is held; alignment is the specific positioning of body parts in relation to each other for efficient movement.",
      "marks": 1
     }
    ]
   }
  },
  {
   "id": "technical-skills-dance-q2",
   "type": "short-answer",
   "question": "Q: Why is spatial awareness important in group dance?",
   "marks": 1,
   "commandWord": "describe",
   "ao": "AO1",
   "difficulty": 2,
   "markScheme": {
    "points": [
     {
      "text": "Spatial awareness allows dancers to maintain correct formations, avoid collisions, use the performance space effectively and ensure the audience can see the choreography.",
      "marks": 1
     }
    ]
   }
  },
  {
   "id": "technical-skills-dance-q3",
   "type": "short-answer",
   "question": "Q: How does control affect the quality of a slow, sustained movement?",
   "marks": 1,
   "commandWord": "describe",
   "ao": "AO1",
   "difficulty": 2,
   "markScheme": {
    "points": [
     {
      "text": "Control enables the dancer to move with even speed and steady dynamics, creating a smooth, continuous line without wobbling or losing balance.",
      "marks": 1
     }
    ]
   }
  },
  {
   "id": "technical-skills-dance-q4",
   "type": "short-answer",
   "question": "Q: Explain how poor alignment can lead to injury.",
   "marks": 1,
   "commandWord": "explain",
   "ao": "AO1",
   "difficulty": 2,
   "markScheme": {
    "points": [
     {
      "text": "Poor alignment places stress on joints and muscles incorrectly, for example landing a jump with misaligned knees can strain ligaments and cause long-term damage.",
      "marks": 1
     }
    ]
   }
  },
  {
   "id": "technical-skills-dance-q5",
   "type": "short-answer",
   "question": "Q: Why are technical skills necessary for expressive performance?",
   "marks": 1,
   "commandWord": "describe",
   "ao": "AO1",
   "difficulty": 2,
   "markScheme": {
    "points": [
     {
      "text": "Without technical accuracy, the dancer cannot communicate the intended mood or meaning clearly — for example, poor control undermines the quality of a soft, lyrical phrase.",
      "marks": 1
     }
    ]
   }
  }
 ]
}