{
 "subject": "food-preparation-nutrition",
 "board": "AQA",
 "topic": "food-production-sustainability",
 "topicName": "Food Production & Sustainability",
 "version": 1,
 "questions": [
  {
   "id": "food-production-sustainability-q1",
   "type": "short-answer",
   "question": "Q: What does food provenance mean?",
   "marks": 1,
   "commandWord": "state",
   "ao": "AO1",
   "difficulty": 2,
   "markScheme": {
    "points": [
     {
      "text": "Food provenance means understanding where food comes from — how, where, and by whom it was produced, processed, and transported to the consumer.",
      "marks": 1
     }
    ]
   }
  },
  {
   "id": "food-production-sustainability-q2",
   "type": "short-answer",
   "question": "Q: What are the main differences between intensive and organic farming?",
   "marks": 1,
   "commandWord": "state",
   "ao": "AO1",
   "difficulty": 2,
   "markScheme": {
    "points": [
     {
      "text": "Intensive farming uses artificial fertilisers, pesticides, and high-density housing to maximise yield cheaply. Organic farming avoids artificial chemicals, uses natural methods like crop rotation, and has higher animal welfare standards but is more expensive with lower yields.",
      "marks": 1
     }
    ]
   }
  },
  {
   "id": "food-production-sustainability-q3",
   "type": "short-answer",
   "question": "Q: Name three ways consumers can reduce the carbon footprint of their food.",
   "marks": 1,
   "commandWord": "state",
   "ao": "AO1",
   "difficulty": 2,
   "markScheme": {
    "points": [
     {
      "text": "Eat less meat (especially beef), choose locally sourced and seasonal foods, reduce food waste, buy foods with less packaging, walk or cycle to shops (any three).",
      "marks": 1
     }
    ]
   }
  },
  {
   "id": "food-production-sustainability-q4",
   "type": "short-answer",
   "question": "Q: What is seasonal eating and why is it more sustainable?",
   "marks": 1,
   "commandWord": "state",
   "ao": "AO1",
   "difficulty": 2,
   "markScheme": {
    "points": [
     {
      "text": "Seasonal eating means consuming foods when they are naturally in season locally. This reduces the need for energy-intensive imports, heated greenhouses, and cold storage, lowering the environmental impact.",
      "marks": 1
     }
    ]
   }
  },
  {
   "id": "food-production-sustainability-q5",
   "type": "short-answer",
   "question": "Q: Why does livestock farming have a higher carbon footprint than crop farming?",
   "marks": 1,
   "commandWord": "describe",
   "ao": "AO1",
   "difficulty": 2,
   "markScheme": {
    "points": [
     {
      "text": "Livestock produce methane (a potent greenhouse gas) during digestion, require large amounts of land and feed (which itself has a carbon cost), and manure releases nitrous oxide. Transport and processing add further emissions.",
      "marks": 1
     }
    ]
   }
  },
  {
   "id": "food-production-sustainability-q6",
   "type": "short-answer",
   "question": "Q: What is the Red Tractor scheme?",
   "marks": 1,
   "commandWord": "state",
   "ao": "AO1",
   "difficulty": 2,
   "markScheme": {
    "points": [
     {
      "text": "A UK food assurance scheme certifying that food has been produced to standards covering food safety, animal welfare, environmental protection, and traceability from farm to pack.",
      "marks": 1
     }
    ]
   }
  },
  {
   "id": "food-production-sustainability-q7",
   "type": "short-answer",
   "question": "Q: Give two advantages and two disadvantages of organic farming.",
   "marks": 1,
   "commandWord": "state",
   "ao": "AO1",
   "difficulty": 2,
   "markScheme": {
    "points": [
     {
      "text": "Advantages: no artificial chemicals (better for soil and biodiversity), higher animal welfare, potentially more nutritious food. Disadvantages: lower yields, higher prices, more land needed per unit of food, less visually perfect produce.",
      "marks": 1
     }
    ]
   }
  },
  {
   "id": "food-production-sustainability-q8",
   "type": "short-answer",
   "question": "Q: Why might locally sourced food not always be the most sustainable choice?",
   "marks": 1,
   "commandWord": "describe",
   "ao": "AO1",
   "difficulty": 2,
   "markScheme": {
    "points": [
     {
      "text": "Some foods grown locally in heated greenhouses may use more energy than the same food grown naturally overseas and shipped. The full carbon footprint must be considered, not just transport distance.",
      "marks": 1
     }
    ]
   }
  },
  {
   "id": "food-production-sustainability-ext",
   "type": "extended",
   "question": "Full-Mark Response Compare intensive and organic farming methods and evaluate their impact on sustainability. (8 marks) <div class=\"",
   "marks": 4,
   "commandWord": "compare",
   "ao": "AO2",
   "difficulty": 4,
   "markScheme": {
    "points": [
     {
      "text": "Intensive farming uses artificial fertilisers, pesticides, antibiotics, and high-density animal housing to maximise food production at low cost. It yields large quantities of affordable food, which helps feed growing populations and keeps consumer prices down. However, it is less sustainable: artificial fertilisers and pesticides degrade soil health and pollute waterways, high-density housing raises serious animal welfare concerns, and antibiotic overuse contributes to antimicrobial resistance. Organic farming avoids artificial chemicals, uses crop rotation and natural fertilisers (compost, ma",
      "marks": 4
     }
    ],
    "exemplarAnswer": "Intensive farming uses artificial fertilisers, pesticides, antibiotics, and high-density animal housing to maximise food production at low cost. It yields large quantities of affordable food, which helps feed growing populations and keeps consumer prices down. However, it is less sustainable: artificial fertilisers and pesticides degrade soil health and pollute waterways, high-density housing raises serious animal welfare concerns, and antibiotic overuse contributes to antimicrobial resistance. Organic farming avoids artificial chemicals, uses crop rotation and natural fertilisers (compost, manure), and provides higher animal welfare with outdoor access. It supports biodiversity, improves soil structure, and avoids pesticide residues. However, organic yields are significantly lower (typically 20–40% less), requiring more land to produce the same amount of food, which can drive deforestation. Organic food is also more expensive, limiting access for lower-income consumers. In terms of sustainability, organic farming is better for local ecosystems and animal welfare, but its lower yields mean a larger land footprint per unit of food. Intensive farming is more land-efficient and affordable but damages the environment long-term. The most sustainable approach may combine elements of both: precision farming to reduce chemical use, integrated pest management, and improving intensive welfare standards while making organic more accessible through policy and innovation."
   }
  }
 ]
}