{
 "subject": "english-language",
 "board": "AQA",
 "topic": "WT1-persuasive-writing",
 "topicName": "Persuasive Writing",
 "version": 1,
 "questions": [
  {
   "id": "wt1-persuasive-writing-q1",
   "type": "short-answer",
   "question": "Name three persuasive techniques and explain how each works.",
   "marks": 1,
   "commandWord": "explain",
   "ao": "AO1",
   "difficulty": 2,
   "markScheme": {
    "points": [
     {
      "text": "Rhetorical questions (make reader think), emotive language (evoke feelings), statistics (add credibility) - plus many other valid techniques.",
      "marks": 1
     }
    ]
   }
  },
  {
   "id": "wt1-persuasive-writing-q2",
   "type": "short-answer",
   "question": "Why is it important to address counter-arguments in persuasive writing?",
   "marks": 1,
   "commandWord": "describe",
   "ao": "AO1",
   "difficulty": 2,
   "markScheme": {
    "points": [
     {
      "text": "It shows you've considered different viewpoints and strengthens your argument by preemptively refuting opposition.",
      "marks": 1
     }
    ]
   }
  },
  {
   "id": "wt1-persuasive-writing-q3",
   "type": "short-answer",
   "question": "Write an opening paragraph persuading your school to introduce a healthy eating policy.",
   "marks": 1,
   "commandWord": "describe",
   "ao": "AO1",
   "difficulty": 2,
   "markScheme": {
    "points": [
     {
      "text": "Your paragraph should include: clear viewpoint, rhetorical question or hook, and persuasive techniques.",
      "marks": 1
     }
    ]
   }
  },
  {
   "id": "wt1-persuasive-writing-q4",
   "type": "short-answer",
   "question": "What is the purpose of a \"call to action\" in persuasive writing?",
   "marks": 1,
   "commandWord": "state",
   "ao": "AO1",
   "difficulty": 2,
   "markScheme": {
    "points": [
     {
      "text": "A call to action tells the reader exactly what you want them to do after reading, making your writing purposeful and memorable.",
      "marks": 1
     }
    ]
   }
  }
 ]
}