{
 "subject": "law",
 "board": "AQA",
 "topic": "tort-law-negligence",
 "topicName": "Tort Law & Negligence",
 "version": 1,
 "questions": [
  {
   "id": "tort-law-negligence-q1",
   "type": "short-answer",
   "question": "Q: What are the four elements the claimant must prove in negligence?",
   "marks": 1,
   "commandWord": "state",
   "ao": "AO1",
   "difficulty": 2,
   "markScheme": {
    "points": [
     {
      "text": "The claimant must prove: (1) the defendant owed them a duty of care, (2) the defendant breached that duty, (3) the breach caused the claimant's damage, and (4) the damage was not too remote.",
      "marks": 1
     }
    ]
   }
  },
  {
   "id": "tort-law-negligence-q2",
   "type": "short-answer",
   "question": "Q: What is the Caparo test for duty of care?",
   "marks": 1,
   "commandWord": "state",
   "ao": "AO1",
   "difficulty": 2,
   "markScheme": {
    "points": [
     {
      "text": "A duty of care exists where: (1) it was reasonably foreseeable that the defendant's conduct could harm the claimant, (2) there was a sufficiently proximate relationship between the parties, and (3) it is fair, just and reasonable to impose a duty.",
      "marks": 1
     }
    ]
   }
  },
  {
   "id": "tort-law-negligence-q3",
   "type": "short-answer",
   "question": "Q: How is breach of duty determined?",
   "marks": 1,
   "commandWord": "describe",
   "ao": "AO1",
   "difficulty": 2,
   "markScheme": {
    "points": [
     {
      "text": "Using the objective test: would a reasonable person in the defendant's position have taken the precautions that the defendant failed to take? If the risk of harm was foreseeable and a reasonable person would have acted differently, there is a breach.",
      "marks": 1
     }
    ]
   }
  },
  {
   "id": "tort-law-negligence-q4",
   "type": "short-answer",
   "question": "Q: What is contributory negligence and what is its effect?",
   "marks": 1,
   "commandWord": "state",
   "ao": "AO1",
   "difficulty": 2,
   "markScheme": {
    "points": [
     {
      "text": "Contributory negligence occurs where the claimant's own carelessness partly caused their injury. Its effect is that damages are reduced by the percentage the claimant was at fault — e.g. if 25% at fault, damages are reduced by 25%.",
      "marks": 1
     }
    ]
   }
  },
  {
   "id": "tort-law-negligence-q5",
   "type": "short-answer",
   "question": "Q: When is an employer vicariously liable?",
   "marks": 1,
   "commandWord": "describe",
   "ao": "AO1",
   "difficulty": 2,
   "markScheme": {
    "points": [
     {
      "text": "An employer is vicariously liable when an employee commits a tort in the course of their employment — even if the employer gave no instructions and was not personally at fault. The key question is whether the employee was acting within the scope of their job.",
      "marks": 1
     }
    ]
   }
  },
  {
   "id": "tort-law-negligence-ext",
   "type": "extended",
   "question": "Full-Mark Response How far does the tort of negligence provide effective compensation for claimants? (15 marks) <div class=\"",
   "marks": 4,
   "commandWord": "describe",
   "ao": "AO2",
   "difficulty": 4,
   "markScheme": {
    "points": [
     {
      "text": "The tort of negligence provides a framework for compensating those harmed by others' carelessness, but significant limitations mean that many claimants do not receive effective compensation. Where all four elements are established, the claimant can recover damages to put them in the position they would have been in had the negligence not occurred. This provides meaningful compensation for those with clear, foreseeable injuries caused by an identifiable defendant. Vicarious liability extends protection by holding employers liable for employees' negligence, ensuring that claimants can sue a part",
      "marks": 4
     }
    ],
    "exemplarAnswer": "The tort of negligence provides a framework for compensating those harmed by others' carelessness, but significant limitations mean that many claimants do not receive effective compensation. Where all four elements are established, the claimant can recover damages to put them in the position they would have been in had the negligence not occurred. This provides meaningful compensation for those with clear, foreseeable injuries caused by an identifiable defendant. Vicarious liability extends protection by holding employers liable for employees' negligence, ensuring that claimants can sue a party with the resources to pay. Contributory negligence, while reducing damages, still allows partially at-fault claimants to recover something. However, the negligence framework has major limitations. The duty of care requirement excludes claimants where the relationship is insufficiently proximate or where the courts consider it unfair to impose liability — this has been used to limit liability for omissions and economic loss. The foreseeability requirement means that unforeseeable types of damage, even if caused by the defendant, are not recoverable. Causation can be impossible to prove where multiple causes contribute to the harm. The cost of litigation is a huge barrier — legal aid for tort claims is almost non-existent, and many claimants cannot afford lawyers. Even successful claimants may receive inadequate damages — the courts use objective measures that do not always reflect the r"
   }
  }
 ]
}