{
 "subject": "music",
 "board": "AQA",
 "topic": "MU14-blues-music-1920-1950",
 "topicName": "Blues Music 1920-1950",
 "version": 1,
 "questions": [
  {
   "id": "mu14-blues-music-1920-1950-q1",
   "type": "short-answer",
   "question": "Describe how blues music 1920-1950 are used in a piece of music you have studied. Use musical vocabulary.",
   "marks": 1,
   "commandWord": "describe",
   "ao": "AO1",
   "difficulty": 2,
   "markScheme": {
    "points": [
     {
      "text": "A detailed description using precise musical vocabulary (e.g. specific terms from the AQA elements list), referencing a named piece with accurate observations about how the elements are used and their effect.",
      "marks": 1
     }
    ]
   }
  },
  {
   "id": "mu14-blues-music-1920-1950-q2",
   "type": "short-answer",
   "question": "Compare how two different pieces use blues music 1920-1950. Explain the effect in each case.",
   "marks": 1,
   "commandWord": "explain",
   "ao": "AO1",
   "difficulty": 2,
   "markScheme": {
    "points": [
     {
      "text": "A comparison of two pieces identifying similarities and differences in how blues music 1920-1950 are used, explaining the different effects created in each musical context, using comparative language.",
      "marks": 1
     }
    ]
   }
  },
  {
   "id": "mu14-blues-music-1920-1950-q3",
   "type": "short-answer",
   "question": "How could you use blues music 1920-1950 in your own composition or performance? Explain your choices.",
   "marks": 1,
   "commandWord": "explain",
   "ao": "AO1",
   "difficulty": 2,
   "markScheme": {
    "points": [
     {
      "text": "A practical application showing understanding of how blues music 1920-1950 can be manipulated in composition or performance, with specific examples of choices made and their intended effect.",
      "marks": 1
     }
    ]
   }
  },
  {
   "id": "mu14-blues-music-1920-1950-ext",
   "type": "extended",
   "question": "Full-Mark Response Analyse a blues track, identifying at least five characteristic blues features using AQA musical vocabulary. Explain how each feature contributes to the style. <div class=\"",
   "marks": 4,
   "commandWord": "explain",
   "ao": "AO2",
   "difficulty": 4,
   "markScheme": {
    "points": [
     {
      "text": "A grade 9 response will: identify 12-bar blues structure with Roman numerals; name blue notes and their scale degrees; explain call and response; identify shuffle rhythm; discuss the evolution from Delta to Chicago blues; use precise terminology. Mark scheme: AO3 (analyse and evaluate) + AO4 (knowledge and understanding) = total marks for listening; AO1 (perform) + AO2 (compose) for coursework components",
      "marks": 4
     }
    ],
    "exemplarAnswer": "A grade 9 response will: identify 12-bar blues structure with Roman numerals; name blue notes and their scale degrees; explain call and response; identify shuffle rhythm; discuss the evolution from Delta to Chicago blues; use precise terminology. Mark scheme: AO3 (analyse and evaluate) + AO4 (knowledge and understanding) = total marks for listening; AO1 (perform) + AO2 (compose) for coursework components"
   }
  }
 ]
}