{
 "subject": "dance",
 "board": "AQA",
 "topic": "stimulus-choreography",
 "topicName": "Stimulus & Starting Points",
 "version": 1,
 "questions": [
  {
   "id": "stimulus-choreography-q1",
   "type": "short-answer",
   "question": "Q: Name the five types of stimulus used in dance choreography.",
   "marks": 1,
   "commandWord": "state",
   "ao": "AO1",
   "difficulty": 2,
   "markScheme": {
    "points": [
     {
      "text": "Visual, auditory, kinaesthetic, ideational and literary.",
      "marks": 1
     }
    ]
   }
  },
  {
   "id": "stimulus-choreography-q2",
   "type": "short-answer",
   "question": "Q: Give an example of a visual stimulus and explain how it could inspire movement.",
   "marks": 1,
   "commandWord": "explain",
   "ao": "AO1",
   "difficulty": 2,
   "markScheme": {
    "points": [
     {
      "text": "A painting of a stormy sea could inspire swirling, expansive movements with sudden changes in dynamics to represent crashing waves.",
      "marks": 1
     }
    ]
   }
  },
  {
   "id": "stimulus-choreography-q3",
   "type": "short-answer",
   "question": "Q: How does an ideational stimulus differ from a literary stimulus?",
   "marks": 1,
   "commandWord": "describe",
   "ao": "AO1",
   "difficulty": 2,
   "markScheme": {
    "points": [
     {
      "text": "An ideational stimulus is a concept or theme (e.g. loneliness), whereas a literary stimulus is based on specific words (e.g. a poem about loneliness).",
      "marks": 1
     }
    ]
   }
  },
  {
   "id": "stimulus-choreography-q4",
   "type": "short-answer",
   "question": "Q: Why might a choreographer choose to combine more than one type of stimulus?",
   "marks": 1,
   "commandWord": "describe",
   "ao": "AO1",
   "difficulty": 2,
   "markScheme": {
    "points": [
     {
      "text": "Combining stimuli can create richer, more layered choreography — for example, using both a visual image and a piece of music to inspire contrasting movement qualities.",
      "marks": 1
     }
    ]
   }
  },
  {
   "id": "stimulus-choreography-q5",
   "type": "short-answer",
   "question": "Q: Explain how a kinaesthetic stimulus could be used to create movement material.",
   "marks": 1,
   "commandWord": "explain",
   "ao": "AO1",
   "difficulty": 2,
   "markScheme": {
    "points": [
     {
      "text": "A kinaesthetic stimulus such as the feeling of tension in the shoulders could be explored and developed into movement phrases that show struggle or restriction.",
      "marks": 1
     }
    ]
   }
  }
 ]
}