{
 "subject": "dance",
 "board": "AQA",
 "topic": "analysing-performance",
 "topicName": "Analysing Dance Performance",
 "version": 1,
 "questions": [
  {
   "id": "analysing-performance-q1",
   "type": "short-answer",
   "question": "Q: What is the advantage of watching a live performance over a recorded one?",
   "marks": 1,
   "commandWord": "state",
   "ao": "AO1",
   "difficulty": 2,
   "markScheme": {
    "points": [
     {
      "text": "Live performance provides the full sensory experience — you feel the energy, scale and atmosphere in real time, and the audience-performer relationship is immediate and tangible.",
      "marks": 1
     }
    ]
   }
  },
  {
   "id": "analysing-performance-q2",
   "type": "short-answer",
   "question": "Q: Why is repeated viewing useful when analysing a recorded dance?",
   "marks": 1,
   "commandWord": "describe",
   "ao": "AO1",
   "difficulty": 2,
   "markScheme": {
    "points": [
     {
      "text": "Repeated viewing lets you focus on different elements each time — first the overall structure, then specific movement details, design features or dancer relationships.",
      "marks": 1
     }
    ]
   }
  },
  {
   "id": "analysing-performance-q3",
   "type": "short-answer",
   "question": "Q: How do the four content categories help structure an analysis?",
   "marks": 1,
   "commandWord": "describe",
   "ao": "AO1",
   "difficulty": 2,
   "markScheme": {
    "points": [
     {
      "text": "They provide a systematic framework so you cover all aspects: action (what), dynamics (how), space (where) and relationships (who), ensuring nothing is missed.",
      "marks": 1
     }
    ]
   }
  },
  {
   "id": "analysing-performance-q4",
   "type": "short-answer",
   "question": "Q: Why should analysis always reference the choreographic intention?",
   "marks": 1,
   "commandWord": "describe",
   "ao": "AO1",
   "difficulty": 2,
   "markScheme": {
    "points": [
     {
      "text": "Every choreographic choice serves the intention — linking your analysis to it shows you understand why decisions were made, not just what they are.",
      "marks": 1
     }
    ]
   }
  },
  {
   "id": "analysing-performance-q5",
   "type": "short-answer",
   "question": "Q: Name two design elements you should consider alongside movement when analysing a dance.",
   "marks": 1,
   "commandWord": "design",
   "ao": "AO1",
   "difficulty": 2,
   "markScheme": {
    "points": [
     {
      "text": "Costume and lighting — though set/staging and aural setting are also valid design elements that contribute to meaning.",
      "marks": 1
     }
    ]
   }
  }
 ]
}