{
 "subject": "english-language",
 "board": "AQA",
 "topic": "WC2-narrative-writing",
 "topicName": "Narrative Writing",
 "version": 1,
 "questions": [
  {
   "id": "wc2-narrative-writing-q1",
   "type": "short-answer",
   "question": "What are the five parts of a classic story arc?",
   "marks": 1,
   "commandWord": "state",
   "ao": "AO1",
   "difficulty": 2,
   "markScheme": {
    "points": [
     {
      "text": "Exposition (introduction), Rising Action (complications), Climax (turning point), Falling Action (consequences), Resolution (conclusion).",
      "marks": 1
     }
    ]
   }
  },
  {
   "id": "wc2-narrative-writing-q2",
   "type": "short-answer",
   "question": "What does \"in medias res\" mean and why is it effective?",
   "marks": 1,
   "commandWord": "state",
   "ao": "AO1",
   "difficulty": 2,
   "markScheme": {
    "points": [
     {
      "text": "\"In medias res\" means starting in the middle of the action. It's effective because it immediately grabs the reader's attention and creates intrigue from the first line.",
      "marks": 1
     }
    ]
   }
  },
  {
   "id": "wc2-narrative-writing-q3",
   "type": "short-answer",
   "question": "Name two ways to reveal character without directly stating traits.",
   "marks": 1,
   "commandWord": "state",
   "ao": "AO1",
   "difficulty": 2,
   "markScheme": {
    "points": [
     {
      "text": "Through dialogue (how they speak), through actions (what they do), through reactions (how they respond to events), through interactions with others, through telling details of appearance or behaviour.",
      "marks": 1
     }
    ]
   }
  },
  {
   "id": "wc2-narrative-writing-q4",
   "type": "short-answer",
   "question": "What is the difference between first person and third person narrative voice?",
   "marks": 1,
   "commandWord": "state",
   "ao": "AO1",
   "difficulty": 2,
   "markScheme": {
    "points": [
     {
      "text": "First person uses \"I\" and is limited to the narrator's perspective, creating intimacy. Third person uses \"he/she/they\" and can be more flexible, showing multiple perspectives or maintaining distance.",
      "marks": 1
     }
    ]
   }
  },
  {
   "id": "wc2-narrative-writing-q5",
   "type": "short-answer",
   "question": "Rewrite this weak opening to be more engaging: \"One day I went to the shops and something happened.\"",
   "marks": 1,
   "commandWord": "describe",
   "ao": "AO1",
   "difficulty": 2,
   "markScheme": {
    "points": [
     {
      "text": "Example: \"The shops were the last place I wanted to be on a Tuesday. But that was before I saw the man in the grey coat watching me from across the street.\"",
      "marks": 1
     }
    ]
   }
  }
 ]
}