{
 "subject": "latin",
 "board": "Edexcel",
 "topic": "verbs-conjugations",
 "topicName": "Verbs & Conjugations",
 "version": 1,
 "questions": [
  {
   "id": "verbs-conjugations-q1",
   "type": "short-answer",
   "question": "Q: What are the four principal parts of a Latin verb?",
   "marks": 1,
   "commandWord": "state",
   "ao": "AO1",
   "difficulty": 2,
   "markScheme": {
    "points": [
     {
      "text": "First person singular present active indicative, present infinitive, first person singular perfect active indicative, and perfect passive participle. Example: laudo, laudare, laudavi, laudatus.",
      "marks": 1
     }
    ]
   }
  },
  {
   "id": "verbs-conjugations-q2",
   "type": "short-answer",
   "question": "Q: How do you identify which conjugation a verb belongs to?",
   "marks": 1,
   "commandWord": "state",
   "ao": "AO1",
   "difficulty": 2,
   "markScheme": {
    "points": [
     {
      "text": "By the characteristic vowel in the present infinitive (second principal part): 1st -are (a), 2nd -ere (e), 3rd -ere (short e/consonant), 4th -ire (i).",
      "marks": 1
     }
    ]
   }
  },
  {
   "id": "verbs-conjugations-q3",
   "type": "short-answer",
   "question": "Q: What are the present tense personal endings?",
   "marks": 1,
   "commandWord": "state",
   "ao": "AO1",
   "difficulty": 2,
   "markScheme": {
    "points": [
     {
      "text": "-o/m (1st singular), -s (2nd singular), -t (3rd singular), -mus (1st plural), -tis (2nd plural), -nt (3rd plural).",
      "marks": 1
     }
    ]
   }
  },
  {
   "id": "verbs-conjugations-q4",
   "type": "short-answer",
   "question": "Q: How is the imperfect tense formed?",
   "marks": 1,
   "commandWord": "describe",
   "ao": "AO1",
   "difficulty": 2,
   "markScheme": {
    "points": [
     {
      "text": "Add -ba- plus personal endings to the present stem. Example: laudabam (I was praising), laudabas (you were praising).",
      "marks": 1
     }
    ]
   }
  },
  {
   "id": "verbs-conjugations-q5",
   "type": "short-answer",
   "question": "Q: What is the difference between active and passive voice?",
   "marks": 1,
   "commandWord": "state",
   "ao": "AO1",
   "difficulty": 2,
   "markScheme": {
    "points": [
     {
      "text": "Active: the subject performs the action (puella laudat — the girl praises). Passive: the subject receives the action (puella laudatur — the girl is praised).",
      "marks": 1
     }
    ]
   }
  },
  {
   "id": "verbs-conjugations-q6",
   "type": "short-answer",
   "question": "Q: How is the perfect tense formed?",
   "marks": 1,
   "commandWord": "describe",
   "ao": "AO1",
   "difficulty": 2,
   "markScheme": {
    "points": [
     {
      "text": "Use the perfect stem (third principal part minus -i) plus perfect endings: -i, -isti, -it, -imus, -istis, -erunt. Example: laudavi (I praised).",
      "marks": 1
     }
    ]
   }
  },
  {
   "id": "verbs-conjugations-q7",
   "type": "short-answer",
   "question": "Q: Name three irregular Latin verbs and their meanings.",
   "marks": 1,
   "commandWord": "state",
   "ao": "AO1",
   "difficulty": 2,
   "markScheme": {
    "points": [
     {
      "text": "Sum (to be), possum (to be able), eo (to go). Also: volo (to want), nolo (not to want), malo (to prefer).",
      "marks": 1
     }
    ]
   }
  },
  {
   "id": "verbs-conjugations-q8",
   "type": "short-answer",
   "question": "Q: What are the present passive personal endings?",
   "marks": 1,
   "commandWord": "state",
   "ao": "AO1",
   "difficulty": 2,
   "markScheme": {
    "points": [
     {
      "text": "-r (I), -ris (you), -tur (he/she/it), -mur (we), -mini (you plural), -ntur (they).",
      "marks": 1
     }
    ]
   }
  }
 ]
}